{
  "schema_version": "1.1",
  "learning_id": "pattern_medical_only_disposition_and_status_precedence",
  "version": 1,
  "status": "active",
  "pattern_state": "VALIDATED",
  "fingerprint": "fp_medical_only_disposition_status_precedence_v1",
  "patch_version": "2.2.0",
  "generic_root_cause": "Multi-line benefit enrollment files mix Medical lines with Dental, Vision, Life, STD/LTD, Accident, Critical Illness, and HSA/FSA lines, causing dental/vision/life-only dependents or part-time excluded dependents to leak into active medical population if not filtered by per-person medical coverage disposition.",
  "applicable_conditions": [
    "Enrollment table includes Plan Type / Plan Category / Provider columns with non-medical lines",
    "Employee elects Medical EE alongside Dental/Vision/Life family tiers (EF/ES/EC)",
    "Census includes Waived (WO), Waiting Period (WP), Not Eligible (NE), or Part-Time rows"
  ],
  "required_validators": [
    "GATE_C_DEPENDENT_DISPOSITION",
    "GATE_D_ENROLLMENT_AND_LINKS",
    "RULE_09_DEPENDENT_DISPOSITION",
    "RULE_20_MOST_USED_PLAN",
    "RULE_21_STATUS_HANDLING",
    "RULE_09_PART_TIME_EXCLUSION"
  ],
  "regression_results": {
    "cases_verified": [
      "case_09_med_ee_dental_ef_excludes_dental_deps",
      "case_10_dep_with_dental_and_med_included_once",
      "case_11_waiver_is_wo_not_wp",
      "case_12_wp_no_most_used_plan",
      "case_13_ne_retained_in_eligibility_census",
      "case_14_part_time_excluded_with_deps"
    ],
    "status": "PASS"
  },
  "created_at": "2026-10-28T15:50:29.124349",
  "updated_at": "2026-10-29T11:16:18.934924",
  "compatibility": {
    "instruction_hashes": [
      "e4b3d00df06ad07dca70230ec26f8f20122c2f10e83d2a697d2b2544e324ae54"
    ],
    "template_hashes": [],
    "parser_versions": [
      "2.1.0"
    ],
    "runtime_prompt_version": "1.0"
  },
  "scope": {
    "document_roles": [
      "census"
    ],
    "file_types": [
      "xlsx",
      "csv"
    ],
    "carriers": [
      "Florida Blue",
      "Cigna"
    ],
    "header_signature": [
      "plan type",
      "plan category",
      "provider",
      "plan name",
      "coverage level value",
      "medical waive reason"
    ],
    "stage": "eligibility"
  },
  "trigger": {
    "issue_type": "NON_MEDICAL_DEPENDENT_INCLUDED",
    "field": "disposition",
    "conditions": [
      "candidate dependent has only non-medical coverage associations or part-time subscriber"
    ]
  },
  "business_rule_refs": [
    "Section 9.1",
    "Section 9.2",
    "Section 9.3",
    "Section 20",
    "Section 21",
    "Repair Section 4"
  ],
  "root_cause": {
    "code": "NON_MEDICAL_DEPENDENT_INCLUDED",
    "verification_status": "verified",
    "summary": "Assign explicit Section 4 dispositions (INCLUDE_ACTIVE_MEDICAL, RETAIN_MEDICAL_STATUS, EXCLUDE_NON_MEDICAL_ONLY, EXCLUDE_PART_TIME, UNRESOLVED) and exclude non-medical-only dependents."
  },
  "strategy": {
    "action": "FILTER_NON_MEDICAL_DEPENDENTS",
    "parameters": {
      "dispositions": [
        "INCLUDE_ACTIVE_MEDICAL",
        "RETAIN_MEDICAL_STATUS",
        "EXCLUDE_NON_MEDICAL_ONLY",
        "EXCLUDE_PART_TIME",
        "UNRESOLVED"
      ]
    },
    "preconditions": [
      "evaluate all coverage associations across sources before finalizing dependent disposition"
    ],
    "exclusions": [
      "never apply Most Used Plan to WP, NE, WO, or RC"
    ]
  },
  "verification": {
    "case_successes": 1,
    "case_failures": 0,
    "regression_fixture_ids": [
      "reg_case_09",
      "reg_case_10",
      "reg_case_11",
      "reg_case_12",
      "reg_case_13",
      "reg_case_14"
    ],
    "negative_fixture_ids": [
      "reg_case_09_dental_only"
    ],
    "checks_passed": [
      "RULE_09_DEPENDENT_DISPOSITION",
      "RULE_20_MOST_USED_PLAN",
      "RULE_21_STATUS_HANDLING",
      "RULE_09_PART_TIME_EXCLUSION"
    ],
    "promotion_eligible": true,
    "last_verified_at": "2026-10-29T11:16:18.851362"
  },
  "promotion": {
    "mode": "auto_allowlisted",
    "decision_ref": "verified_20261029_111618",
    "reason": "Validated against Section 6 execution gates and Section 7 regression suite"
  },
  "usage": {
    "attempted": 0,
    "successful": 0,
    "rolled_back": 0
  }
}