{
  "schema_version": "1.1",
  "learning_id": "pattern_meritain_statement_parsing",
  "version": 1,
  "status": "active",
  "pattern_state": "VALIDATED",
  "fingerprint": "fp_meritain_statement_parsing_v1",
  "patch_version": "2.2.0",
  "generic_root_cause": "Multi-division TPA billing statements (e.g. Meritain Health group 14642) format subscribers as 'LAST FIRST' without commas and organize lines by DIVISION blocks. Strict comma requirements in fragment filters dropped valid subscribers, collapsing invoice counts and causing blank Match %.",
  "applicable_conditions": [
    "Invoice is a structured Meritain Health or TPA billing statement",
    "Document organizes subscribers under division headers with fixed-cost premiums",
    "Subscriber names are formatted without commas"
  ],
  "required_validators": [
    "RULE_26_INVOICE_EXTRACTION_FIDELITY",
    "RULE_29_INVOICE_PRESENCE_FALSE_POSITIVE"
  ],
  "regression_results": {
    "cases_verified": [
      "case_meritain_statement_high_fidelity"
    ],
    "status": "PASS"
  },
  "created_at": "2026-10-29T13:24:05.525959",
  "updated_at": "2026-10-29T19:17:09.777303",
  "compatibility": {
    "instruction_hashes": [
      "e4b3d00df06ad07dca70230ec26f8f20122c2f10e83d2a697d2b2544e324ae54"
    ],
    "template_hashes": [],
    "parser_versions": [
      "2.1.0"
    ],
    "runtime_prompt_version": "1.0"
  },
  "scope": {
    "document_roles": [
      "invoice"
    ],
    "file_types": [
      "pdf",
      "txt"
    ],
    "carriers": [
      "Meritain",
      "Cigna",
      "Aetna"
    ],
    "header_signature": [
      "division",
      "billing statement",
      "meritain"
    ],
    "stage": "invoice_parsing"
  },
  "trigger": {
    "issue_type": "INVOICE_EXTRACTION_COLLAPSE",
    "field": "records",
    "conditions": [
      "invoice subscriber count collapsed relative to text volume"
    ]
  },
  "business_rule_refs": [
    "Section 5.1",
    "Section 16.1",
    "Section 29.1"
  ],
  "root_cause": {
    "code": "INVOICE_EXTRACTION_COLLAPSE",
    "verification_status": "verified",
    "summary": "Deterministic statement parsing extracts division-specific subscribers and maps plans and fixed-cost monthly premiums without comma requirements."
  },
  "strategy": {
    "action": "PARSE_MERITAIN_STATEMENT",
    "parameters": {
      "high_fidelity_statement_parser": true
    },
    "preconditions": [
      "invoice contains division headers and subscriber rows"
    ],
    "exclusions": [
      "do not parse non-medical billing lines"
    ]
  },
  "verification": {
    "case_successes": 1,
    "case_failures": 0,
    "regression_fixture_ids": [
      "reg_case_meritain"
    ],
    "negative_fixture_ids": [],
    "checks_passed": [
      "RULE_26_INVOICE_EXTRACTION_FIDELITY",
      "RULE_29_INVOICE_PRESENCE_FALSE_POSITIVE"
    ],
    "promotion_eligible": true,
    "last_verified_at": "2026-10-29T19:17:09.414895"
  },
  "promotion": {
    "mode": "auto_allowlisted",
    "decision_ref": "verified_20261029_191709",
    "reason": "Validated against Section 6 execution gates and Section 7 regression suite"
  },
  "usage": {
    "attempted": 0,
    "successful": 0,
    "rolled_back": 0
  }
}