{
  "schema_version": "1.1",
  "learning_id": "pattern_part_time_strict_exclusion",
  "version": 1,
  "status": "active",
  "pattern_state": "VALIDATED",
  "fingerprint": "fp_part_time_strict_exclusion_v1",
  "patch_version": "2.2.0",
  "generic_root_cause": "Under Section 9.1, employees identified as Part-Time (PT) must be excluded from the medical census regardless of whether medical coverage is indicated in the source file, preventing population inflation.",
  "applicable_conditions": [
    "Census contains Part-Time (PT) employees in employment status or worker category",
    "Part-time records must be excluded from employee totals, enrollment totals, and deliverable census"
  ],
  "required_validators": [
    "RULE_09_PART_TIME_EXCLUSION",
    "GATE_A_SOURCE_COVERAGE"
  ],
  "regression_results": {
    "cases_verified": [
      "case_part_time_strict_exclusion"
    ],
    "status": "PASS"
  },
  "created_at": "2026-10-29T13:24:05.543465",
  "updated_at": "2026-10-29T15:50:02.145707",
  "compatibility": {
    "instruction_hashes": [
      "e4b3d00df06ad07dca70230ec26f8f20122c2f10e83d2a697d2b2544e324ae54"
    ],
    "template_hashes": [],
    "parser_versions": [
      "2.1.0"
    ],
    "runtime_prompt_version": "1.0"
  },
  "scope": {
    "document_roles": [
      "census"
    ],
    "file_types": [
      "xlsx",
      "xlsm",
      "xls",
      "csv"
    ],
    "carriers": [
      "Florida Blue",
      "Cigna",
      "Aetna"
    ],
    "header_signature": [
      "status",
      "employee status",
      "ft/pt",
      "worker category"
    ],
    "stage": "eligibility"
  },
  "trigger": {
    "issue_type": "PART_TIME_EMPLOYEE_INCLUDED",
    "field": "worker_category",
    "conditions": [
      "part-time employee present in output census"
    ]
  },
  "business_rule_refs": [
    "Section 9.1",
    "Repair Section 1"
  ],
  "root_cause": {
    "code": "PART_TIME_EMPLOYEE_INCLUDED",
    "verification_status": "verified",
    "summary": "Enforce strict Section 9.1 exclusion of part-time employees and attached dependents during census population finalization."
  },
  "strategy": {
    "action": "EXCLUDE_PART_TIME_POPULATION",
    "parameters": {
      "exclude_part_time": true
    },
    "preconditions": [
      "record marked PT or part-time"
    ],
    "exclusions": [
      "do not exclude full-time employees"
    ]
  },
  "verification": {
    "case_successes": 1,
    "case_failures": 0,
    "regression_fixture_ids": [
      "reg_case_pt_strict"
    ],
    "negative_fixture_ids": [],
    "checks_passed": [
      "RULE_09_PART_TIME_EXCLUSION"
    ],
    "promotion_eligible": true,
    "last_verified_at": "2026-10-29T15:50:01.728785"
  },
  "promotion": {
    "mode": "auto_allowlisted",
    "decision_ref": "verified_20261029_155002",
    "reason": "Validated against Section 6 execution gates and Section 7 regression suite"
  },
  "usage": {
    "attempted": 0,
    "successful": 0,
    "rolled_back": 0
  }
}