{
  "schema_version": "1.1",
  "learning_id": "pattern_post_sort_subscriber_row_recalculation",
  "version": 1,
  "status": "active",
  "pattern_state": "VALIDATED",
  "fingerprint": "fp_post_sort_subscriber_row_recalc_v1",
  "patch_version": "2.2.0",
  "generic_root_cause": "Sorting enrolled vs non-enrolled employees, filtering excluded dependents, or adding invoice-only rows alters sequential row numbers, requiring post-sort recalculation of Data Row (row_no) and subscriber link (sub_row) before workbook generation.",
  "applicable_conditions": [
    "Census contains linked dependents and undergoes ordering or status refinement",
    "Dual workbook generation (Marsh + SBU) for Cigna non-Florida routing"
  ],
  "required_validators": [
    "GATE_D_ENROLLMENT_AND_LINKS",
    "GATE_F_OUTPUT_CONSISTENCY",
    "RULE_09_SUBSCRIBER_ROW_LINKS"
  ],
  "regression_results": {
    "cases_verified": [
      "case_15_idempotent_rerun_counts_and_versions",
      "case_16_cross_prospect_pattern_reuse"
    ],
    "status": "PASS"
  },
  "created_at": "2026-10-28T15:50:29.143900",
  "updated_at": "2026-10-28T18:19:31.108844",
  "compatibility": {
    "instruction_hashes": [
      "e4b3d00df06ad07dca70230ec26f8f20122c2f10e83d2a697d2b2544e324ae54"
    ],
    "template_hashes": [],
    "parser_versions": [
      "2.1.0"
    ],
    "runtime_prompt_version": "1.0"
  },
  "scope": {
    "document_roles": [
      "census",
      "deliverable"
    ],
    "file_types": [
      "xlsx"
    ],
    "carriers": [
      "Florida Blue",
      "Cigna"
    ],
    "header_signature": [
      "data row",
      "dep of",
      "sub row"
    ],
    "stage": "writer"
  },
  "trigger": {
    "issue_type": "SUBSCRIBER_ROW_LINK_STALE",
    "field": "sub_row",
    "conditions": [
      "post-sort or post-filter row order finalized"
    ]
  },
  "business_rule_refs": [
    "Section 9.4",
    "Section 10.3",
    "Repair Section 5.2",
    "Repair Section 6"
  ],
  "root_cause": {
    "code": "SUBSCRIBER_ROW_LINK_STALE",
    "verification_status": "verified",
    "summary": "Recalculate sequential row_no and dependent sub_row after all sorting, filtering, and invoice-only additions."
  },
  "strategy": {
    "action": "RECALCULATE_SUBSCRIBER_LINKS",
    "parameters": {
      "recalculate_after_sort": true,
      "verify_marsh_sbu_agreement": true
    },
    "preconditions": [
      "final canonical population order established"
    ],
    "exclusions": [
      "invoice-only rows do not receive census Data Row numbers"
    ]
  },
  "verification": {
    "case_successes": 1,
    "case_failures": 0,
    "regression_fixture_ids": [
      "reg_case_15",
      "reg_case_16"
    ],
    "negative_fixture_ids": [],
    "checks_passed": [
      "RULE_09_SUBSCRIBER_ROW_LINKS"
    ],
    "promotion_eligible": true,
    "last_verified_at": "2026-10-28T18:19:31.043461"
  },
  "promotion": {
    "mode": "auto_allowlisted",
    "decision_ref": "verified_20261028_181931",
    "reason": "Validated against Section 6 execution gates and Section 7 regression suite"
  },
  "usage": {
    "attempted": 0,
    "successful": 0,
    "rolled_back": 0
  }
}